### ISSUE TITLE
Mosquitto incorrectly times out spind client

### ISSUE THREAD

**Issue by ElmerLastdrager** [SIDN/spin#17]
The mosquitto broker disconnects the spind-client for a timeout. This is odd, because the client works normally.

The mosquitto logs show the following:

> Client asdf has exceeded timeout, disconnecting.
> Socket error on client asdf, disconnecting.

The Wireshark trace suggests that there is no attempt to ping from the mosquitto server (port 1883) to the client (port 44416). It 'just' disconnects the client.

> 18:09:17.522142 IP localhost.44416 > localhost.1883: Flags [P.], seq 4678:5106, ack 1, win 5462, options [nop,nop,TS val 782307 ecr 777057], length 428
> 18:09:17.522411 IP localhost.1883 > localhost.44416: Flags [.], ack 5106, win 7204, options [nop,nop,TS val 782307 ecr 782307], length 0
> **18:10:47.489544 IP localhost.1883 > localhost.44416: Flags [F.], seq 1, ack 5106, win 7204, options [nop,nop,TS val 791304 ecr 782307], length 0**
> 18:10:47.490396 IP localhost.44416 > localhost.1883: Flags [F.], seq 5106, ack 2, win 5462, options [nop,nop,TS val 791304 ecr 791304], length 0

The timeout occurs after at least 60 seconds of no traffic. The keepalive timeout on the client is set to 60 seconds. Reducing the client timeout to 30 seconds increases the number of occurrences of the timeout, and reduces the time at which they occur.

When the client-side timeout is put to 7200 seconds (for example), the timeout occurs a lot later.

The mosquitto api [defines](https://mosquitto.org/api/files/mosquitto-h.html#mosquitto_connect) the keepalive as:
> the number of seconds after which the broker should send a PING message to the client if no other messages have been exchanged in that time.

It appears that the broker, in our deployment, does not send a PING message after the timeout. It just disconnects the client after that time. According to the source (and comments to a [test case](https://github.com/eclipse/mosquitto/blob/5487395fb67ad2e2b6dac1ff67bd0ac289383f09/test/lib/01-keepalive-pingreq.py)), the client is responsible for sending a PINGREQ after keepalive. Apparently, our client library does not do that.

Main question: who has to take care of sending a PINGREQ message?

**Comment by ElmerLastdrager** [comment]
According to the [standard](http://docs.oasis-open.org/mqtt/mqtt/v3.1.1/os/mqtt-v3.1.1-os.html#_Ref363645900), the client is responsible for sending a PINGREQ command after the keepalive has expired.

The question that remains: why do our clients (both in javascript and libmosquitto) not send a PINGREQ after the keepalive has expired?

Furthermore, the documentation of mosquitto api on the keepalive parameter is wrong.

**Comment by ElmerLastdrager** [comment]
Documentation inconsistency reported: https://github.com/eclipse/mosquitto/issues/621 

The timeout was caused by our own assumptions, fixed in 8cdf035f82abcb848f7b2bda313bb0f1093c16fc and 2863e243cf6977f3f2c0b2d04e4ceaa254bcd08f.

Closing this issue.
